{
  "contrato": "CTR-08",
  "contratoVersion": 2,
  "juego": "dos-ejes",
  "actualizado": "2026-10-05",
  "preguntasPorEje": 5,
  "momentos": [
    { "id": "previa", "nombre": "La previa", "canta": "Botella cortada, guitarra afinando, olor a yerba." },
    { "id": "ida", "nombre": "La ida", "canta": "Ventanilla empañada, latas rodando, ruta que se estira." },
    { "id": "vereda", "nombre": "La vereda", "canta": "Pies en el barro y un parlante lejano." },
    { "id": "adentro", "nombre": "Cuando suena", "canta": "Golpe en el pecho y todos cantan." },
    { "id": "vuelta", "nombre": "La vuelta", "canta": "Zapatillas embarradas, llave en la puerta." }
  ],
  "cuadrantes": [
    {
      "id": "CU-1",
      "luzOscuridad": "luz",
      "ordenCaos": "orden",
      "nombre": "Mesa larga a las nueve",
      "bajada": "Hay una hora, un lugar, un chori en la parrilla y gente que te espera: la noche ya sabe adónde va. Pero cuando alguien cambia la hora, a vos te toca rearmar la mesa.",
      "estado": "listo"
    },
    {
      "id": "CU-2",
      "luzOscuridad": "luz",
      "ordenCaos": "caos",
      "nombre": "Ronda en cualquier esquina",
      "bajada": "Te sumás a lo que aparece —una guitarra, un cantito, otra canción— y la noche toma forma. Pero cuando alguien pregunta adónde siguen, a vos te toca elegir ahí mismo.",
      "estado": "listo"
    },
    {
      "id": "CU-3",
      "luzOscuridad": "oscuridad",
      "ordenCaos": "orden",
      "nombre": "Radio bajita, misma hora",
      "bajada": "Te cosés la noche a medida, puntada por puntada, con un disco y el puesto de siempre. Pero cuando alguien adelanta la salida, a vos te toca mover lo que venía después.",
      "estado": "listo"
    },
    {
      "id": "CU-4",
      "luzOscuridad": "oscuridad",
      "ordenCaos": "caos",
      "nombre": "Mochila liviana, sin mapa",
      "bajada": "Con las botamangas que ya vieron barro, un cambio te abre otro y cada uno te alegra. Pero cuando alguien quiere saber el rumbo, a vos te toca averiguarlo en el celular.",
      "estado": "listo"
    }
  ],
  "items": [
    {
      "id": "EJ-001",
      "us": ["US-06"],
      "eje": "luz-oscuridad",
      "enunciado": "Terminó el recital y salís a la calle. ¿Cómo te sentís?",
      "opciones": [
        { "texto": "Con la sonrisa puesta", "polo": "luz" },
        { "texto": "Con el cuerpo hecho pomada", "polo": "oscuridad" }
      ],
      "estado": "retirado",
      "notaInterna": "Retirado (T-126): no son alternativas del mismo eje (ánimo contra cuerpo) y la lectura se invierte — salir hecho pomada certifica presencia hasta el final, no lo contrario. Reemplazado por EJ-023."
    },
    {
      "id": "EJ-002",
      "us": ["US-06"],
      "eje": "luz-oscuridad",
      "enunciado": "Se te corta la luz en plena noche. ¿Qué hacés?",
      "opciones": [
        { "texto": "Aviso a los vecinos", "polo": "luz" },
        { "texto": "Prendo velas y sigo leyendo", "polo": "oscuridad" }
      ],
      "estado": "retirado",
      "notaInterna": "Retirado (T-335, D-57): la partida pasa a ser una noche en cinco momentos y esta escena no es de la noche."
    },
    {
      "id": "EJ-003",
      "us": ["US-06"],
      "eje": "luz-oscuridad",
      "enunciado": "Un perro te sigue por la vereda. ¿Qué hacés?",
      "opciones": [
        { "texto": "Silbo y seguimos los dos", "polo": "luz" },
        { "texto": "Apuro el paso y sigo", "polo": "oscuridad" }
      ],
      "estado": "retirado",
      "notaInterna": "Retirado (T-127): mide condición (miedo a los perros), no temperamento — mismo defecto que EJ-006, en el mismo lote que nadie había revisado. Reemplazado por EJ-026."
    },
    {
      "id": "EJ-004",
      "us": ["US-06"],
      "eje": "luz-oscuridad",
      "enunciado": "Te despierta una tormenta a la madrugada. ¿Qué hacés?",
      "opciones": [
        { "texto": "Busco compañía y me quedo", "polo": "luz" },
        { "texto": "Salgo a ver los rayos", "polo": "oscuridad" }
      ],
      "estado": "retirado",
      "notaInterna": "Retirado (T-335, D-57): la partida pasa a ser una noche en cinco momentos y esta escena no es de la noche."
    },
    {
      "id": "EJ-005",
      "us": ["US-06"],
      "eje": "luz-oscuridad",
      "enunciado": "Te encontrás plata tirada en la calle. ¿Qué hacés?",
      "opciones": [
        { "texto": "Compro algo para compartir", "polo": "luz" },
        { "texto": "Me lo guardo para mí", "polo": "oscuridad" }
      ],
      "estado": "retirado",
      "notaInterna": "Retirado (T-127): las opciones no son compañía contra soledad, son generoso contra amarrete — un constructo distinto, y el que peor pasa la prueba de decirse en voz alta con el mismo orgullo. Reemplazado por EJ-027."
    },
    {
      "id": "EJ-006",
      "us": ["US-06"],
      "eje": "luz-oscuridad",
      "enunciado": "Se cruza un gato negro en tu camino. ¿Qué pensás?",
      "opciones": [
        { "texto": "Qué lindo gato, lo saludo", "polo": "luz" },
        { "texto": "Mal augurio, apuro el paso", "polo": "oscuridad" }
      ],
      "estado": "retirado",
      "notaInterna": "Retirado (T-126): mide superstición, no temperamento — la opción B no está disponible para quien no cree, así que su respuesta real vive adentro de la A. Reemplazado por EJ-021."
    },
    {
      "id": "EJ-007",
      "us": ["US-06"],
      "eje": "luz-oscuridad",
      "enunciado": "Es tu cumpleaños. ¿Cómo te gusta pasarlo?",
      "opciones": [
        { "texto": "Con torta y mesa larga", "polo": "luz" },
        { "texto": "En pijama, con algo rico", "polo": "oscuridad" }
      ],
      "estado": "retirado",
      "notaInterna": "Retirado (T-335, D-57): la partida pasa a ser una noche en cinco momentos y esta escena no es de la noche."
    },
    {
      "id": "EJ-008",
      "us": ["US-06"],
      "eje": "luz-oscuridad",
      "enunciado": "Tenés una tarde libre y nada planeado. ¿Qué hacés?",
      "opciones": [
        { "texto": "Llamo a alguien y salimos", "polo": "luz" },
        { "texto": "Cierro la puerta y respiro", "polo": "oscuridad" }
      ],
      "estado": "retirado",
      "notaInterna": "Retirado (T-335, D-57): la partida pasa a ser una noche en cinco momentos y esta escena no es de la noche."
    },
    {
      "id": "EJ-009",
      "us": ["US-06"],
      "eje": "luz-oscuridad",
      "enunciado": "Se corta la señal del celular. ¿Qué sentís?",
      "opciones": [
        { "texto": "Me pongo nervioso, la busco", "polo": "luz" },
        { "texto": "Alivio, nadie me ubica", "polo": "oscuridad" }
      ],
      "estado": "retirado",
      "notaInterna": "Retirado (T-126): asimetría de opciones — el alivio compite con una emoción incómoda nombrada, la B gana sin competir. Reemplazado por EJ-022."
    },
    {
      "id": "EJ-010",
      "us": ["US-06"],
      "eje": "luz-oscuridad",
      "enunciado": "Te desvela algo a la madrugada. ¿Qué hacés?",
      "opciones": [
        { "texto": "Le escribo a alguien igual", "polo": "luz" },
        { "texto": "Anoto todo en un cuaderno", "polo": "oscuridad" }
      ],
      "estado": "retirado",
      "notaInterna": "Retirado (T-335, D-57): la partida pasa a ser una noche en cinco momentos y esta escena no es de la noche."
    },
    {
      "id": "EJ-011",
      "us": ["US-06"],
      "eje": "orden-caos",
      "enunciado": "Te enterás de un recital para esta noche. ¿Qué hacés?",
      "opciones": [
        { "texto": "Reviso bien antes de salir", "polo": "orden" },
        { "texto": "Salgo ya, después veo", "polo": "caos" }
      ],
      "estado": "retirado",
      "notaInterna": "Retirado (T-126): el 'sabor ricotero' funciona como credencial de pertenencia, la línea que BR-17 no deja cruzar. Reemplazado por EJ-025."
    },
    {
      "id": "EJ-012",
      "us": ["US-06"],
      "eje": "orden-caos",
      "enunciado": "Organizás un asado con amigos. ¿Cómo lo armás?",
      "opciones": [
        { "texto": "Con lista y horario fijo", "polo": "orden" },
        { "texto": "Aviso esa misma mañana", "polo": "caos" }
      ],
      "estado": "retirado",
      "notaInterna": "Retirado (T-335, D-57): la partida pasa a ser una noche en cinco momentos y esta escena no es de la noche."
    },
    {
      "id": "EJ-013",
      "us": ["US-06"],
      "eje": "orden-caos",
      "enunciado": "Armás el bolso para un viaje. ¿Cuándo lo hacés?",
      "opciones": [
        { "texto": "Una semana antes, con lista", "polo": "orden" },
        { "texto": "La noche antes, nomás", "polo": "caos" }
      ],
      "estado": "retirado",
      "notaInterna": "Retirado (T-335, D-57): la partida pasa a ser una noche en cinco momentos y esta escena no es de la noche."
    },
    {
      "id": "EJ-014",
      "us": ["US-06"],
      "eje": "orden-caos",
      "enunciado": "Tenés que armar un mueble nuevo. ¿Cómo empezás?",
      "opciones": [
        { "texto": "Leo el manual entero", "polo": "orden" },
        { "texto": "Pruebo hasta que encastre", "polo": "caos" }
      ],
      "estado": "retirado",
      "notaInterna": "Retirado (T-335, D-57): la partida pasa a ser una noche en cinco momentos y esta escena no es de la noche."
    },
    {
      "id": "EJ-015",
      "us": ["US-06"],
      "eje": "orden-caos",
      "enunciado": "Alguien te cambia el plan de golpe, ya con todo armado. ¿Qué hacés?",
      "opciones": [
        { "texto": "Sigo con lo que armé", "polo": "orden" },
        { "texto": "Me subo al cambio nuevo", "polo": "caos" }
      ],
      "estado": "retirado",
      "notaInterna": "Retirado (T-335, D-57): la partida pasa a ser una noche en cinco momentos y esta escena no es de la noche."
    },
    {
      "id": "EJ-016",
      "us": ["US-06"],
      "eje": "orden-caos",
      "enunciado": "Guardás la ropa limpia recién lavada. ¿Cómo la ponés?",
      "opciones": [
        { "texto": "Doblada y por color", "polo": "orden" },
        { "texto": "Toda junta en el cajón", "polo": "caos" }
      ],
      "estado": "retirado",